company_brand,founded,headquarter,sector,what_it_does,investor,amount($),stage,year,stage_of_startup
Traveo Soft Pvt. Ltd.,2016,Bangalore,Hospitality,AI based Business Travel & Expense management,Hindustan Media Venture,17578.8,Venture - Series Unknown,2018,Early Stage
Em Personal Care,2016,Worli,Beauty & Fashion,Em Personal Care is a Cosmetic products manufacturing Company.,"Alia Bhatt, Katrina Kaif",3000000.0,Seed,2018,Early Stage
Lucideus,2016,New Delhi,Business,"Lucideus is a cybersecurity company that offers its customers with consultancy, training, and solutions to counteract cyber-attacks.",Inflection Point Ventures,5000000.0,Venture - Series Unknown,2018,Early Stage
Eupheus Learning,2016,Delhi,Education,Eupheus Learning offers a seamless integrated learning solution for the K-12 market in India.,Inflection Point Ventures,3000000.0,Seed,2018,Early Stage
GamingMonk,2016,New Delhi,Sports,"GamingMonk is an eSports gaming company based out of New Delhi, India.",Punit Balan,585960.0,Series A,2018,Early Stage
Sukkhi Jewellery,2016,Mumbai,Beauty & Fashion,Sukkhi Jewellery is a Contemporary fashion jewellery brand.,"Alia Bhatt, Katrina Kaif",7470990.0,Venture - Series Unknown,2018,Early Stage
INDwealth,2016,Gurgaon,Finance,INDwealth is an Artificial Intelligence (AI) powered wealth management company,"9Unicorns, ZNL",32227800.0,Seed,2018,Early Stage
Medikabazaar,2016,Mumbai,Transport,India's largest medical and surgical supplies marketplace,Mumbai Angels Network,5000000.0,Series A,2018,Early Stage
NIRA,2016,Bangalore,Finance,"NIRA promotes financial inclusion by creating simple, transparent products that empower individuals to live a life of choice and freedom.","9Unicorns, ZNL",1000000.0,Seed,2018,Early Stage
Duroflex Pvt. Ltd.,2016,Alleppey,Commerce,Duroflex Pvt. Ltd. operates as a dominant mattress player.,Inflection Point Ventures,22000000.0,Private Equity,2018,Early Stage
Clensta,2016,New Delhi,LifeStyle,A biotechnology start-up was incorporated to improve the National Hygiene condition whilst addressing the aspect of water conservation.,9Unicorns,3000000.0,Seed,2018,Early Stage
Jetbrain Robotics,2016,Gurgaon,Hospitality,"Jetbrain Robotics is Hong Kong / Gurgaon based company, building advanced robotic transportation solutions for multi speciality hospitals.",Hindustan Media Venture,70000.0,Seed,2018,Early Stage
Medimetry,2016,Haryana,Health,"MediMetry is an online platform where patients can consult specialists doctors online - from anywhere, at anytime.",Venture Catalysts,3000000.0,Seed,2018,Early Stage
Healthkart,2016,Gurgaon,LifeStyle,"The one stop shop for health, fitness & beauty.",9Unicorns,10000000.0,Venture - Series Unknown,2018,Early Stage
Indiabulls Ventures,2016,Mumbai,Finance,Indiabulls Ventures Limited is one of India’s leading capital market companies providing securities and derivative broking services.,"9Unicorns, ZNL",225477408.0,Post-IPO Equity,2018,Early Stage
Vistara,2016,Haryana,Transport,Vistara is a joint venture of Tata Sons Limited and Singapore Airlines Limited (SIA),Mumbai Angels Network,292980000.0,Private Equity,2018,Early Stage
ClearTax,2016,New Delhi,Technology,ClearTax India helps individuals prepare and e-file their Income Tax Return online.,Venture Catalysts,58596000.0,Series B,2018,Early Stage
Shuttl,2016,Gurgaon,Transport,"Shuttl provides an app-based office shuttle service to make daily commute safe, reliable, affordable and dignified for everyone.",Mumbai Angels Network,1000000.0,Debt Financing,2018,Early Stage
GuruQ,2016,New Delhi,Technology,A one of its kind digital integrated platform connecting tutors and students.,Venture Catalysts,366225.0,Seed,2018,Early Stage
Azure Power,2016,New Delhi,Energy,"Azure Power produces and distributes solar power to commercial, government, and utility customers in India.","Alia Bhatt, IAN Fund, Social Alpha, Draper Richards Kaplan Foundation",185000000.0,Post-IPO Equity,2018,Early Stage
Cube,2016,Mumbai,Finance,Cube is consumer banking focused fintech company.,"9Unicorns, ZNL",2050860.0,Series A,2018,Early Stage
RAHI Care,2016,Chandigarh,Hospitality,RAHI Care is a Health Care company.,Hindustan Media Venture,3000000.0,Venture - Series Unknown,2018,Early Stage
Mynvax,2016,Bangalore,Health,Mynvax is a biotech Company.,Venture Catalysts,3000000.0,Angel,2018,Early Stage
Loans4SME,2016,Mumbai,Finance,Loans4SME is an alternative lending platform.,"9Unicorns, ZNL",3000000.0,Seed,2018,Early Stage
UpCyclersLab,2016,Mumbai,Education,UpCyclersLab is a startup that makes sustainability-based learning tools for children above the age of five.,Inflection Point Ventures,3000000.0,Seed,2018,Early Stage
Cellerite Systems,2016,Hyderabad,Transport,Cellerite Systems is a charging solutions provider for electric vehicles.,Mumbai Angels Network,3000000.0,Seed,2018,Early Stage
Taru Naturals,2016,Mumbai,Agriculture,Taru Naturals is a network that connects farmer communities with clean technology and renewable energy.,"FMO, IndusInd Bank",3000000.0,Seed,2018,Early Stage
LetsMD,2016,New Delhi,LifeStyle,LetsMD.com is a marketplace for elective surgeries,9Unicorns,1000000.0,Seed,2018,Early Stage
Twenty Two Motors,2016,Haryana,Transport,Twenty Two Motors aim of making cutting edge EV technology affordable for the current generation.,Mumbai Angels Network,65000000.0,Corporate Round,2018,Early Stage
Truebil,2016,Mumbai,Transport,"Truebil is a team of young, highly motivated professionals who strive to help you buy and sell used cars in the simplest way possible.",Mumbai Angels Network,2000000.0,Series A,2018,Early Stage
FarmersFZ,2016,Kochi,Agriculture,FarmersFZ is an online venture for fresh and safe vegetables and agri products.,"FMO, IndusInd Bank",3000000.0,Seed,2018,Early Stage
Worxogo,2016,Bangalore,Technology,worxogo’s is a pioneering persuasive technology products align employee behaviours .,Venture Catalysts,2417085.0,Series A,2018,Early Stage
Vivish Technologies (myGate),2016,Bengaluru,Business,India's leading mobile based security management solution .,Inflection Point Ventures,9521850.0,Series A,2018,Early Stage
Singularity Dynamics,2016,Bengaluru,Technology,Singularity Dynamics is a Chip-design testing startup.,Venture Catalysts,3000000.0,Seed,2018,Early Stage
Virtual MetalStreet(MetalStreet),2016,Bengaluru,Commerce,Virtual MetalStreet(Metalstreet) is a B2B marketplace for steel trading in India,Inflection Point Ventures,700000.0,Angel,2018,Early Stage
Veritas Finance,2016,Guindy,Finance,Veritas Finance has been promoted with a primary purpose of meeting the working capital and business credit requirements of the small bus.,"9Unicorns, ZNL",30000000.0,Venture - Series Unknown,2018,Early Stage
Manjushree Technopack,2016,Bangalore,Commerce,Manjushree Technopack is a Rigid plastics packaging convertor in India and South Asia.,Inflection Point Ventures,3000000.0,Private Equity,2018,Early Stage
GoZefo,2016,Bangalore,Commerce,Startup working on a white space in the eCommerce industry.,Inflection Point Ventures,3076290.0,Venture - Series Unknown,2018,Early Stage
Zomato,2016,Gurgaon,Food & Beverages,Zomato is a search app offering detailed information for restaurants as well as online food delivery.,Coatue Management,210000000.0,Secondary Market,2018,Early Stage
Innov8 Coworking,2016,New Delhi,Business,Innov8 is a Y- Combinator backed company that offers coworking and shared office spaces.,Inflection Point Ventures,4000000.0,Seed,2018,Early Stage
RevFin,2016,Delhi,Finance,RevFin is a digital lending company.,"9Unicorns, ZNL",3000000.0,Seed,2018,Early Stage
Lavelle Networks,2016,Bengaluru,Business,Lavelle Networks provides Software Defined WAN (SD-WAN) Solutions to build end to end Enterprise Networking Platforms for tomorrow,Inflection Point Ventures,292980.0,Venture - Series Unknown,2018,Early Stage
Blackbuck,2016,Bengaluru,Transport,Blackbuck is a logistics startup based in India.,Mumbai Angels Network,29731610.400000002,Series D,2018,Early Stage
Cardekho,2016,Gurgaon,Transport,Cardekho is a car search venture that helps users buy cars that are right for them.,Mumbai Angels Network,75000000.0,Series C,2018,Early Stage
ElasticRun,2016,Pune,Transport,ElasticRun develops an online system that improves the reception of orders from customers and the dispatch of delivery drivers in India.,Mumbai Angels Network,8789400.0,Series B,2018,Early Stage
Droom Technology Private Limited,2016,Gurgaon,Transport,Droom is a marketplace for automobiles and automobile services.,Mumbai Angels Network,30000000.0,Series E,2018,Early Stage
Vogo Rentals,2016,Kormangala,Transport,Vogo is a dockless scooter rental company in India which lets customers rent scooters for short one way trips.,Mumbai Angels Network,1171920.0,Debt Financing,2018,Early Stage
InnerChef,2016,Gurgaon,Transport,InnerChef is an online food discovery and delivery experience that will make the foodie in you come alive.,Mumbai Angels Network,1760000.0,Venture - Series Unknown,2018,Early Stage
LivQuik,2016,Mumbai,Commerce,LivQuik was incorporated with the vision to simplify payments for merchants and consumers in an increasingly digital world,Inflection Point Ventures,2700000.0,Corporate Round,2018,Early Stage
Disprz,2016,Chennai,Education,"Disprz is a one-of-its-kind “knowledge-tech” start-up that strives to make people knowledgeable, productive and smarter at what they do.",Inflection Point Ventures,400000.0,Debt Financing,2018,Early Stage
9stacks,2016,Delhi,Sports,Online gaming startup.,Punit Balan,4101720.0,Series A,2018,Early Stage
Origo,2016,Gurgaon,Business,"Origo Commodities, a complete post-harvest management services for agricultural commodities, is the fastest growing company in its sector.",Inflection Point Ventures,11719200.0,Venture - Series Unknown,2018,Early Stage
YourOwnROOM,2016,Bangalore,Business,"Good quality, strategically located homes closer to work for millennials",Inflection Point Ventures,750000.0,Seed,2018,Early Stage
Vahdam Teas,2016,New Delhi,Transport,Vahdam Teas is a vertically integrated online-first tea brand that sources premium garden fresh teas direct from over 150+ tea plantations.,Mumbai Angels Network,2500000.0,Series B,2018,Early Stage
Spoofin,2016,New Delhi,Business,A social networking app that lets you create and view Spoofs of your favourite videos.,Inflection Point Ventures,3000000.0,Venture - Series Unknown,2018,Early Stage
Strom Motors,2016,Mumbai,Transport,Strom Motors is a smart urban mobility Company.,Mumbai Angels Network,3000000.0,Angel,2018,Early Stage
PharmEasy,2016,Mumbai,LifeStyle,PharmEasy - Indias largest healthcare delivery platform,9Unicorns,80000000.0,Series C,2018,Early Stage
Licious,2016,Bengaluru,Transport,"Licious is an online meat and fish ordering startup that solves existing problem of finding safe, delectable, trustworthy fresh meat.",Mumbai Angels Network,25000000.0,Series C,2018,Early Stage
Stanza Living,2016,New Delhi,Hospitality,Stanza Living is a co-living platform created for students moving to a new place.,Hindustan Media Venture,10693770.0,Venture - Series Unknown,2018,Early Stage
docturnal,2016,Hyderabad,Health,"Docturnal, an online platform, enables individuals to find information and diagnostic services related to diabetes, cancer, and more.",Venture Catalysts,3000000.0,Seed,2018,Early Stage
Bounce (Metro Bikes),2016,Bangalore,Transport,"Bounce (formerly Metro Bikes) is an urban mobility solution that makes daily commute stress-free, time-saving, reliable, and convenient.",Mumbai Angels Network,3000000.0,Debt Financing,2018,Early Stage
Technology 9 Labs (T9L),2016,New Delhi,Technology,Technology 9 Labs is an Information Technology and Services company.,Venture Catalysts,3000000.0,Corporate Round,2018,Early Stage
Goals101,2016,Delhi,Finance,Goals101 is a one of the fastest growing big-data platforms.,"9Unicorns, ZNL",3500000.0,Seed,2018,Early Stage
Satya MicroCapital,2016,New Delhi,Finance,New Delhi-based non-banking financial company.,"9Unicorns, ZNL",5859600.0,Venture - Series Unknown,2018,Early Stage
Ummeed Housing Finance Private Limited,2016,Haryana,Finance,Ummeed Housing Finance Private Limited,"9Unicorns, ZNL",8789400.0,Series C,2018,Early Stage
StockEdge,2016,Kolkata,Business,"StockEdge is a unique platform, which is 100% focused on research and analytics",Inflection Point Ventures,1100000.0,Seed,2018,Early Stage
Sequretek,2016,Mumbai,Technology,Sequretek is a cyber security start-up.,Venture Catalysts,3700000.0,Venture - Series Unknown,2018,Early Stage
Avenues Payments India Pvt. Ltd.,2016,Mumbai,Technology,Avenues Payments is an IT solutions provider for the remittance\money transfer and forex industries.,Venture Catalysts,1300000.0,Corporate Round,2018,Early Stage
Qbera,2016,Bangalore,Finance,Qbera is a managed marketplace for unsecured personal loans.,"9Unicorns, ZNL",2050860.0,Venture - Series Unknown,2018,Early Stage
Urban Ladder,2016,Bangalore,LifeStyle,Urban Ladder is a Bangalore-based online furniture company.,9Unicorns,5600000.0,Debt Financing,2018,Early Stage
Planet11 eCommerce Solutions India (Avenue11),2016,Bengaluru,Commerce,"Planet11 is backed by SK Planet, which is a part of the SK Group – one of the largest conglomerates in South Korea.",Inflection Point Ventures,3808740.0,Corporate Round,2018,Early Stage
DailyNinja,2016,Bengaluru,Technology,"Daily Ninja, a mobile app that delivers daily needs on a subscription model",Venture Catalysts,3000000.0,Series A,2018,Early Stage
Iba Halal Care,2016,Ahmedabad,Beauty & Fashion,Iba Halal Care is a cosmetics brand company.,"Alia Bhatt, Katrina Kaif",2197350.0,Series A,2018,Early Stage
Knocksense,2016,Lucknow,Media & Entertainment,Knocksense is a fast growing lifestyle website.,"9Unicorns, Ashneer Grover",3000000.0,Seed,2018,Early Stage
Togedr,2016,Gurgaon,Hospitality,Togedr is an activity discovery & booking platform.,Hindustan Media Venture,3000000.0,Venture - Series Unknown,2018,Early Stage
Parkwheels,2016,Haryana,Manufacturing,"Parkwheels aims at solving the big, bad & unsexy parking problems of India.","Pegasus Tech Ventures, Base Partners",175788.0,Seed,2018,Early Stage
ShareChat,2016,Bangalore,Business,ShareChat is a social networking and regional content platform for the fast growing Internet users in India.,Inflection Point Ventures,99230000.0,Series C,2018,Early Stage
Cyclops Medtech,2016,Bangalore,Transport,Medtech startup working on clinical and wearable diagnostic and rehab products for neuro vestibular disorders using eye tracking technology.,Mumbai Angels Network,1000000.0,Seed,2018,Early Stage
Livspace,2016,Bangalore,LifeStyle,"Livspace is the new online shopping destination where you can design, decorate and furnish your dream home.",9Unicorns,70000000.0,Series C,2018,Early Stage
NewsBytes,2016,Gurgaon,Transport,NewsBytes provides your everyday news in a contextual timeline to reduce information overload.,Mumbai Angels Network,1000000.0,Seed,2018,Early Stage
Leena AI,2016,Gurgaon,Business,Leena is smart AI powered HR companion dedicated towards engaging employees.,Inflection Point Ventures,2000000.0,Seed,2018,Early Stage
Max Healthcare,2016,New Delhi,Business,Max Healthcare is one of the leading chain of hospitals in India.,Inflection Point Ventures,3000000.0,Corporate Round,2018,Early Stage
GoBolt,2016,New Delhi,Transport,Delhi-based logistics technology.,Mumbai Angels Network,5859600.0,Venture - Series Unknown,2018,Early Stage
GoGaga,2016,Bangalore City,Business,GoGaga is a new age dating app that has removed the mindless swiping on strangers and connects users through their network and find matches.,Inflection Point Ventures,40000.0,Non-equity Assistance,2018,Early Stage
Mate Labs,2016,Bangalore,Education,Mate Labs is a machine learning solutions platform for beginners.,Inflection Point Ventures,550000.0,Seed,2018,Early Stage
Furlenco,2016,Bangalore,LifeStyle,Furlenco is a Bangalore-based company that offers a home furniture subscription program.,9Unicorns,3000000.0,Series C,2018,Early Stage
Ola,2016,Kormangala,Transport,Ola is a mobile app that brings together cab drivers and customers using technology to make transportation hassle-free in India.,Mumbai Angels Network,50000000.0,Venture - Series Unknown,2018,Early Stage
DocPrime,2016,Haryana,Finance,DocPrime offers a one-stop healthcare solution right at the comfort of patients' homes.,"9Unicorns, ZNL",50000000.0,Funding Round,2018,Early Stage
CLP India Pvt. Ltd.,2016,Mumbai,Energy,CLP India Pvt. Ltd. is a foreign investor in the Indian power sector.,"Alia Bhatt, IAN Fund, Social Alpha, Draper Richards Kaplan Foundation",365000000.0,Private Equity,2018,Early Stage
Xplorabox,2016,Noida,Education,Xplorabox is as an educational activity box subscription startup aiming to revolutionize the early education industry.,Inflection Point Ventures,3000000.0,Seed,2018,Early Stage
Myra,2016,Bangalore,Health,Myra is a unique solution of technology and operations that makes buying medicines fast and efficient.,Venture Catalysts,128178.75,Venture - Series Unknown,2018,Early Stage
Vokal,2016,Bengaluru,Business,India's Largest Peer-to-Peer Knowledge Sharing Platform in Indian Languages.,Inflection Point Ventures,1500000.0,Series A,2018,Early Stage
Kissht,2016,Mumbai,Finance,"Kissht is a financial technology platform that enables instant, seamless credit for consumers to make purchases at digital points of sales","9Unicorns, ZNL",30000000.0,Series C,2018,Early Stage
Upwards Fintech,2016,Mumbai,Finance,Upwards Fintech financial company.,"9Unicorns, ZNL",5000000.0,Series A,2018,Early Stage
Bon(Bonfleet Solutions),2016,Pune,Finance,"Bon, a Pune-based FinTech firm was created to bring financial services to the gig-economy workforce.","9Unicorns, ZNL",1142622.0,Seed,2018,Early Stage
Mamaearth,2016,Gurgaon,Commerce,Mamaearth is an online retailer specializing in baby and toddler products.,Inflection Point Ventures,4000000.0,Series A,2018,Early Stage
BabyChakra,2016,Mumbai,Health,BabyChakra is India's largest & most loved platform to discover the right maternity and childcare.,Venture Catalysts,3000000.0,Series B,2018,Early Stage
Belstar Investment and Finance Private Limited,2016,Chennai,Finance,Belstar Investment and Finance Private Limited is a provider of scalable microfinance services to entrepreneurs.,"9Unicorns, ZNL",28000000.0,Venture - Series Unknown,2018,Early Stage
Naaptol,2016,Mumbai,Commerce,"Koku Gamer is an online platform that offers gaming related news, editorials, reviews, previews, and other content.",Inflection Point Ventures,15000000.0,Venture - Series Unknown,2018,Early Stage
Moonshine Meadery,2016,Pune,Transport,Moonshine Meadery is a first craft meadery.,Mumbai Angels Network,3000000.0,Seed,2018,Early Stage
Verzeo,2016,Bangalore,Education,Verzeo is anAI-focussed edtech startup.,Inflection Point Ventures,5000000.0,Series A,2018,Early Stage
Haazri,2016,Mumbai,Transport,Haazri is a tea and snack quick service restaurant startup,Mumbai Angels Network,183112.5,Seed,2018,Early Stage
Connect India,2016,New Delhi,Transport,"To create pervasive network where connections are simpler, more powerful, more affordable, more global and more available to all.",Mumbai Angels Network,3000000.0,Angel,2018,Early Stage
Flyrobe,2016,Mumbai,Beauty & Fashion,Flyrobe is an on-demand apparel rental platform that provides premium designer wear.,"Alia Bhatt, Katrina Kaif",3867336.0,Series B,2018,Early Stage
Scholify,2016,Bengaluru,Education,Edutech,Inflection Point Ventures,3000000.0,Pre-Seed,2018,Early Stage
Dream11,2016,Mumbai,Sports,"Dream11 is India’s Biggest Sports Game with 30 million+ users playing Fantasy Cricket, Football, Kabaddi and NBA.",Punit Balan,100000000.0,Series D,2018,Early Stage
srJna,2016,Jaipur,Education,"SRJNA is a brand of Elation Edtech Pvt. Ltd., which helps schools to integrate hands on, affordable and turnkey STEM.",Inflection Point Ventures,3000000.0,Seed,2018,Early Stage
Nykaa,2016,Mumbai,Beauty & Fashion,Nykaa.com is a premier online beauty and wellness destination,"Alia Bhatt, Katrina Kaif",16553370.0,Secondary Market,2018,Early Stage
Chaayos,2016,New Delhi,Transport,Chaayos was born in November 2012 out of this premise - a contemporary interpretation of the chai adda.,Mumbai Angels Network,11865690.0,Series B,2018,Early Stage
Heelium,2016,Pune,LifeStyle,Heelium is an athletic footwear and wearable startup with primary focus on sports safety and sustainability.,9Unicorns,3000000.0,Seed,2018,Early Stage
LT Foods,2016,New Delhi,Transport,LT Foods believe that nature will continue to nurture us until we as a species continue to breathe and live.,Mumbai Angels Network,20508600.0,Post-IPO Equity,2018,Early Stage
Multibashi,2016,Bengaluru,Education,Free language learning platform.,Inflection Point Ventures,146490.0,Seed,2018,Early Stage
Cleardekho,2016,Ghaziabad,Beauty & Fashion,Uttar Pradesh based online eyewear marketplace.,"Alia Bhatt, Katrina Kaif",3000000.0,Venture - Series Unknown,2018,Early Stage
Dailyhunt,2016,Bangalore,Media & Entertainment,NewsHunt is a Bangalore based eBooks company.,"9Unicorns, Ashneer Grover",6000000.0,Series E,2018,Early Stage
SlicePay,2016,Bengaluru,Commerce,SlicePay is an AI based instant credit app for youngsters in India.,Inflection Point Ventures,14900000.0,Series A,2018,Early Stage
Udaan,2016,Bangalore,Transport,"Udaan is a B2B trade platform, designed specifically for small and medium businesses in India.",Mumbai Angels Network,225000000.0,Series C,2018,Early Stage
Happyeasygo Group,2016,Haryana,Hospitality,HappyEasyGo is an online travel domain.,Hindustan Media Venture,3000000.0,Series A,2018,Early Stage
Mombay,2016,Mumbai,Transport,Mombay is a unique opportunity for housewives to start household food business and avail everyone with their homemade healthy dishes.,Mumbai Angels Network,7500.0,Seed,2018,Early Stage
Droni Tech,2016,Mumbai,Technology,Droni Tech manufacture UAVs and develop software to service a range of industry requirements.,Venture Catalysts,512715.0,Seed,2018,Early Stage
Netmeds,2016,Chennai,Health,Welcome to India's most convenient pharmacy!,Venture Catalysts,35000000.0,Series C,2018,Early Stage
Bombay Shaving,2015,New Delhi,Commerce,Provides a range of male grooming products,Sixth Sense Ventures,6300000.0,Venture - Series Unknown,2019,Established
Ruangguru,2014,Mumbai,Education,"A learning platform that provides topic-based journey, animated videos, quizzes, infographic and mock tests to students",General Atlantic,150000000.0,Series C,2019,Established
Eduisfun,2015,Mumbai,Education,It aims to make learning fun via games.,"Deepak Parekh, Amitabh Bachchan, Piyush Pandey",28000000.0,Fresh funding,2019,Established
HomeLane,2014,Chennai,LifeStyle,Provides interior designing solutions,"Evolvence India Fund (EIF), Pidilite Group, FJ Labs",30000000.0,Series D,2019,Established
Nu Genes,2004,Telangana,Agriculture,"It is a seed company engaged in production, processing and marketing of seeds",Innovation in Food and Agriculture (IFA),6000000.0,Venture - Series Unknown,2019,Established
FlytBase,2015,Pune,Technology,A drone automation platform,Undisclosed,3000000.0,Venture - Series Unknown,2019,Established
Finly,2015,Bangalore,Technology,"It builds software products that makes work simpler, pleasant, and productive","Social Capital, AngelList India, Gemba Capital, Omphalos Ventures,  91springboard via Atal Innovation Mission, Niti Aayog.",3000000.0,Venture - Series Unknown,2019,Established
Kratikal,2013,Noida,Technology,It is a product-based cybersecurity solutions provider,"Gilda VC, Art Venture, Rajeev Chitrabhanu.",1000000.0,Pre series A,2019,Established
Quantiphi,2015,Pune,Technology,It is an AI and big data services company providing business solutions.,Multiples Alternate Asset Management,20000000.0,Series A,2019,Established
Lenskart,2010,Delhi,Commerce,It is a eyewear company,SoftBank,275000000.0,Series G,2019,Established
Cub McPaws,2010,Mumbai,Commerce,A B2C  brand that focusses on premium and comfortable merchandise for Generation Alpha – kids,Venture Catalysts,3000000.0,Venture - Series Unknown,2019,Established
Appnomic,2015,Bangalore,Technology,"It is a self-healing enterprise, the IT operations software detects, predicts and prevents problems before they happen",Avataar Ventures,22000000.0,Venture - Series Unknown,2019,Established
Kaleidofin,2018,Chennai,Technology,Platform that provides complete financial solutions for excluded individuals and households,Oikocredit,5000000.0,Series A,2019,Early Stage
JobSquare,2019,Ahmedabad,Business,Technology-based platform that is connecting suitable applicants to the right recruiters,Titan Capital,140500.0,Venture - Series Unknown,2019,Early Stage
Open Secret,2015,New Delhi,Food & Beverages,It produces and sells top quality snacks,Matrix Partners,3000000.0,Venture - Series Unknown,2019,Established
LivFin,2017,Delhi,Technology,"Grants small business loans, supply chain finance and working capital loans to small and medium enterprises",German development finance institution DEG,5000000.0,Venture - Series Unknown,2019,Early Stage
Byju's,2011,Pune,Education,Provides online learning classes,"South Africa’s Naspers Ventures, the CPP Investment Board",540000000.0,Venture - Series Unknown,2019,Established
Zest Money,2015,Bangalore,Technology,Uses AI to do risk profiling of e-commerce consumers who opt for EMI,Goldman Sachs.,15000000.0,Series B,2019,Established
Witblox,2014,Mumbai,Education,Offers a range of robotics learning tools,Mumbai Angels Network,182700.0,Venture - Series Unknown,2019,Established
Azah Personal Care Pvt. Ltd.,2018,Gurugram,Health,Aims to solve some problems in the feminine hygiene sector,"Kunal Bahl, Rohit Bansal.",3000000.0,Pre series A,2019,Early Stage
SalaryFits,2015,Bangalore,Technology,A platform that promotes financial well-being of employees at workplace,Brazilian VC Fund Confrapar,5000000.0,Venture - Series Unknown,2019,Established
