company_brand,founded,headquarter,sector,what_it_does,investor,amount($),stage,year,stage_of_startup
Illumnus,2016,Mumbai,Education,Offers Collaborative learning management system for educational institutions,Angel investors. HNI,100000.0,Seed Round,2020,Early Stage
LetsTransport,2015,Bangalore,Technology,Offers techno logistics solutions,Innoven Capital,1715000.0,Venture - Series Unknown,2020,Established
Eggoz,2017,Bihar,Agriculture,"Provides technology backed, deep integration services to egg farmers","Tracxn Labs, Angellist, Tri-Deep Capital",329000.0,Seed Round,2020,Early Stage
Winuall,2018,Bangalore,Education,It helps coaching institutes in digitization,"Ankit Bhati, Nitin Gupta",3000000.0,Venture - Series Unknown,2020,Early Stage
Indian School Finance Company,2016,Hyderabad,Technology,NBFC that provides funding to education system,Gray Matters Capital,5271000.0,Seed Round,2020,Early Stage
Juicy Chemistry,2014,Delhi,Beauty & Fashion,It focuses on organic based skincare products,Akya Ventures,650000.0,Series A,2020,Established
DeepTek,2018,Pune,Health,AI enabled radiology platform,GHV Accelerator,3000000.0,Venture - Series Unknown,2020,Early Stage
Stepathlon Lifestyle,2012,Mumbai,LifeStyle,It organises corporate wellness programs,"Josh Liberman, Mark Adams",3000000.0,Venture - Series Unknown,2020,Established
Sindhuja Microcredit,2018,Noida,Technology,It provides financial services to self employed women entrepreneurs,Nordic Microfinance Initiative,8700000.0,Venture - Series Unknown,2020,Early Stage
Rentmojo,2012,Bangalore,Real Estate,"Rental platform for furniture, appliances & electronics","Chiratae Ventures, Accel Partners, BCIP Venture Associates, Bain Capital, Renaud Laplanche",3226000.0,Venture - Series Unknown,2020,Established
Tesco Charge Zone,2016,Gujarat,Transport,Operates electric vehicle charging zone,Mumbai Angels Network,3000000.0,Venture - Series Unknown,2020,Early Stage
Intello Labs,2016,Gurugram,Commerce,Standardisation and Quality control of fruits & vegetables,Saama Capital,5900000.0,Series A,2020,Early Stage
SirionLabs,2012,Gurugram,Technology,"Provides procurement, outsourcing services & contract management software","Tiger Global, Avatar Growth Capital",44000000.0,Series C,2020,Established
Magicpin,2015,Delhi,Commerce,"It is a local discovery, rewards, and commerce platform",Lightspeed Venture Partners,3879000.0,Venture - Series Unknown,2020,Established
GroCurv,2019,Gurugram,Commerce,"It offers a wide range of business related services like Branding, marketing, sales etc.,",Unicorn Investments Pte Ltd,3000000.0,Seed Round,2020,Early Stage
Refrens,2019,Bangalore,Technology,"Offers a free invoicing, payments and expense management system","Vijay Shekhar Sharma, Anupam Mittal",1000000.0,Seed Round,2020,Early Stage
Shiprocket,2017,Bangalore,Technology,Tech enabled logistics aggregator,"Tribe Capital, Innoven Capital, BII",13000000.0,Series C,2020,Early Stage
Spyne,2016,Gurugram,Technology,Helps online businesses with visual content,"Angellist, Smile Group, Manish Amin, Anil Goel, Anubhav Sonthalia, Deepak Mittal",3000000.0,Pre series A,2020,Early Stage
Nykaa,2012,Mumbai,Commerce,Deals in cosmetic and wellness products,Steadview capital,8800000.0,Venture - Series Unknown,2020,Established
Docsapp,2015,Bangalore,Health,Online doctor consultation app,"Bessemer Venture Partners India, Fusian Capital, Rebright Partners, Milliways Fund LLC",9500000.0,Venture - Series Unknown,2020,Established
Phable,2018,Pune,Health,"It creates an engagement loop between doctors, hospitals, and patients via its app",Inflection Point Ventures,1000000.0,Pre series A,2020,Early Stage
Generic Aadhaar,2016,Mumbai,Health,It provides a platform for entrepreneurs to access generic  medicine at low cost,Ratan Tata,3000000.0,Venture - Series Unknown,2020,Early Stage
Nium,2016,Bangalore,Technology,Open global money platform,"VisaVentures, BRI Ventures",3000000.0,Venture - Series Unknown,2020,Early Stage
Mintoak,2016,Mumbai,Technology,Merchant payment solutions startup,Pravega Ventures,2000000.0,Pre series A,2020,Early Stage
VestSpace,2018,Pune,Technology,It builds small satellite paltforms,Next Capital,10000000.0,Venture - Series Unknown,2020,Early Stage
Blackbuck,2015,Bangalore,Transport,Provides trucking services,Trifecta Venture,3000000.0,Venture - Series Unknown,2020,Established
Vernacular ai,2016,Bangalore,Technology,It offers Multiligual AI platform,"Exfinity Ventures, IAN Fund",5100000.0,Series A,2020,Early Stage
Clover,2016,Bangalore,Agriculture,Provides agricultural solution to farmers working in the greenhouse production of vegetables and fruits,Alteria Capital,920000.0,Venture - Series Unknown,2020,Early Stage
Varthana,2016,Bangalore,Technology,Offers secured and unsecured loans,ChrysCapital,15000000.0,Series D,2020,Early Stage
Codeninja,2016,Bangalore,Technology,AI-powered 'no-code' platform which can generate application development code,"Hari Balasubramanian, EaSyndicate",3000000.0,Seed Round,2020,Early Stage
MetaMerphoSys,2016,Pune,Finance,Digital insurance platform for businesses,Good Capital,3000000.0,Pre series A,2020,Early Stage
Rooter,2016,Delhi,Manufacturing,Live sports engagement platform,"Paytm, leAD Sports, Rockstud Capital, Founder Bank Capital",1700000.0,Pre series A,2020,Early Stage
Aker Foods,2019,Pune,Transport,Ai driven supply chain platform,Mumbai Angels Network,3000000.0,Venture - Series Unknown,2020,Early Stage
Sascan Meditech pvt ltd,2015,Kerala,Health,They are developing technology that can detect early cancerous cells,Unicorn India Ventures,3000000.0,Venture - Series Unknown,2020,Established
DailyHunt,2009,Chennai,Media & Entertainment,News aggregator,Lupa India,35600000.0,Venture - Series Unknown,2020,Established
Pratilipi,2014,Bangalore,Media & Entertainment,A digital platform that connects readers and writers in various languages,Tencent,9400000.0,Series C,2020,Established
Biryani By Kilo,2016,Delhi,Food & Beverages,Online paltform to order biryani,"Devanshu Dolat Desai, Anand M Khatau, Debasish Priyadarshi Purohit, Kaushik Shanghvi",790000.0,Series B,2020,Early Stage
Consure Medical,2016,Delhi,Health,"Novel platform technologies to manage, diagnose, and treat various GI disorders","Accel Partners, Jungle Ventures",480000.0,Venture - Series Unknown,2020,Early Stage
Servify,2016,Bangalore,Technology,It is a technology company which serves as a platform for brands to offer end-to-end solutions to their users,Barkawi,250000.0,Venture - Series Unknown,2020,Early Stage
Tessol,2016,Mumbai,Transport,It provides end to end cold chain logistics solutions,1Funds Domestic Scheme,160000.0,Series A,2020,Early Stage
Remedo,2016,Noida,Health,"It helps doctors engage with patients, improve patient experience",RiverRock Ventures,3000000.0,Pre series A,2020,Early Stage
News Reach,2018,Ahmedabad,Media & Entertainment,"It is a platform that digitalises local newspaper publishers, reporters, stringers by aggregating their content",Mumbai Angels Network,3000000.0,Venture - Series Unknown,2020,Early Stage
RoomSoom,2016,Noida,Real Estate,It provides co-living and student rooms,Mumbai Angels Network,3000000.0,Venture - Series Unknown,2020,Early Stage
Pedagogy,2015,Bangalore,Education,It has a single subscription model that allows users to access books and digital courses.,Inflection Point Ventures,400000.0,Venture - Series Unknown,2020,Established
Classplus,2008,Delhi,Education,"It provides mobile-first software for coaching institutes, tuition centres and private tutors",RTP Global,8200000.0,Series B,2020,Established
Medlife,2014,Bangalore,Health,It solves inadequacies in the healthcare delivery system through technology,Hero Fincorp,15500000.0,Venture - Series Unknown,2020,Established
Qin1,2016,Noida,Education,It is alearning platform for kids in the age group 5 to 14 yrs,Venture Catalysts,3000000.0,Venture - Series Unknown,2020,Early Stage
MYSUN,2015,Delhi,Technology,Platform for rooftop solar energy solutions,Undisclosed,4257000.0,Pre series A,2020,Established
ShopX,2015,Bangalore,Commerce,B2B retail operating system,Li and Fung,1410000.0,Venture - Series Unknown,2020,Established
Sarva,2016,Mumbai,LifeStyle,It drives a cultural change in making yoga-based wellness a part of modern lifestyle,"Mantra Capital, Patni Family",3000000.0,Venture - Series Unknown,2020,Early Stage
Expertrons,2016,Mumbai,Technology,AI video bot platform for career hacks,"Nikhil Vora, Iceland Venture Studio, LetsVenture, Samyakth Capital",3000000.0,Seed Round,2020,Early Stage
NewsBytes,2016,Gurugram,Media & Entertainment,News portal,North Base Media,1500000.0,Series A,2020,Early Stage
Wagonfly,2018,Gurugram,Commerce,Contactless shopping and delivery experience by using radio frequency to tag retail items,Investment Trust of India,500000.0,Venture - Series Unknown,2020,Early Stage
NIRA,2018,Bangalore,Technology,It offers access and credit to working Indians,Angel investors,2100000.0,Pre series A,2020,Early Stage
Convosight,2019,Hyderabad,Business,It helps business gain insights from its community on Facebook groups,"IvyCap Ventures, Sequoia Capital",4000000.0,Pre series A,2020,Early Stage
Fittr,2016,Pune,LifeStyle,Fitness Social Network & Consultation Platform,"Sequoia Capital Surge, Better Capital",2000000.0,Venture - Series Unknown,2020,Early Stage
AsknBid,2018,Bangalore,Business,It builds algorithmic investing-based tech products,Ravikanth Reddy & Mumbai Angel Network,3000000.0,Venture - Series Unknown,2020,Early Stage
Bira91,2015,Bangalore,Transport,Craft beer maker,"Sequoia Capital, Sofina",20000000.0,Series C,2020,Established
Finaureus Technologies,2017,Pune,Technology,Provides investment management solutions,Pinetree Capital,3000000.0,Pre series A,2020,Early Stage
Daily Ninja,2014,Haryana,Commerce,Online Milk Delivery startup,Big Basket,349800.0,Venture - Series Unknown,2020,Established
Guvi Geek Network Pvt Ltd,2014,Chennai,Education,Operates vernacular-language based education,Education Catalyst Fund,786000.0,Pre series A,2020,Established
LoadShare,2017,Bangalore,Transport,Provides technology based solutions to SMEs in logistics,CDC Group,2004000.0,Series B,2020,Early Stage
Vedantu,2016,Bangalore,Education,Onine learning platform,KB Global Platform Firm,6800000.0,Series C,2020,Early Stage
Indusface,2004,Chandigarh,Technology,It provides IT security solutions,Tata Capital Growth Fund II,5000000.0,Venture - Series Unknown,2020,Established
DMI Group,2008,Delhi,Finance,Pan-India Credit providing platform,NXC Corporation,123000000.0,Venture - Series Unknown,2020,Established
Spintly,2017,Goa,Technology,It is a wireless cloud-based access control system,Saltwater Venture Sparks,248000.0,Pre series A,2020,Early Stage
Credr,2014,Mumbai,Technology,A marketplace to buy and sell used bikes and scooters,Stride Ventures,3000000.0,Venture - Series Unknown,2020,Established
Bijak,2016,Gurugram,Agriculture,"It is a platform that gives agricultural commodity at better prices, increased working capital, and optimised logistics",RTP Global,12000000.0,Series A,2020,Early Stage
Bugworks,2014,Bangalore,Health,A drug discovery company that aims to discover novel treatment options for resistant bacterial infections,"University of Tokyo Edge Capital, Global Brain Corporation",7500000.0,Venture - Series Unknown,2020,Established
DrinkPrime,2016,Mumbai,Government,Water purifier subscription service,"Abhishek Goyal, Bharat Jaisinghani, FirstCheque",3000000.0,Seed Round,2020,Early Stage
Yap,2016,Chennai,Technology,Banking and payment products-focused API platform,BeeNext,4500000.0,Series A,2020,Early Stage
UzhavarBumi,2017,Tamil Nadu,Agriculture,Provides fresh dairy products,Angel Network,3000000.0,Venture - Series Unknown,2020,Early Stage
Tattva,2018,Delhi,Beauty & Fashion,Sells its organic and beauty products via marketplace,"Sukhbir Singh, Rakhee Singal",150000.0,Venture - Series Unknown,2020,Early Stage
Pariksha,2015,Pune,Education,Platform for vernacular test-preparation,"INSEAD Angels, IIT Kanpur Angels, Sixth Sense Ventures, Saahil Bhatia",3000000.0,Pre series A,2020,Established
DailyHunt,2016,Delhi,Media & Entertainment,News aggregator,"Bytedance, Falcon Edge, Goldman Sachs, Advent Management",24000000.0,Venture - Series Unknown,2020,Early Stage
NoBroker,2014,Bangalore,Real Estate,Online real estate rental startup,General Atlantic,30000000.0,Venture - Series Unknown,2020,Established
Box8,2011,Mumbai,Food & Beverages,Enables to order food online,"IIFL Seed Ventures Fund, Menlo park",4000000.0,Venture - Series Unknown,2020,Established
Capital Float,2013,Bangalore,Technology,Online platform that provides working capital finance to SMEs,"Ribbit Capital, SAIF Partners, Sequoia Capital India, Amazon",15000000.0,Venture - Series Unknown,2020,Established
ITILITE,2016,Bangalore,Hospitality,Platform for business travel,"Greenoaks Capital, Vy Capital. Matrix Partners India",13000000.0,Series B,2020,Early Stage
Morning Context,2016,Ahmedabad,Media & Entertainment,A subscription-only digital media publisher,Angel investors,3000000.0,Seed Round,2020,Early Stage
Aavenir,2019,Ahmedabad,Technology,Source-to-Pay Software,Accel,2000000.0,Seed Round,2020,Early Stage
Savvy Co op,2016,Ahmedabad,Health,It connects patients with healthcare companies,Indie VC,3000000.0,Venture - Series Unknown,2020,Early Stage
BLive,2018,New Delhi,Transport,"It offers experiential, guided tours on smart electric bikes",Mumbai Angels Network,3000000.0,Pre series A,2020,Early Stage
Yellow Messenger,2016,Bangalore,Technology,It offers conversational chatbots,"Lightspeed Venture Partners, Lightspeed India Partners.",20000000.0,Series B,2020,Early Stage
Toch,2016,New Delhi,Media & Entertainment,AI based Video object detection and Tagging platform,Inflection Point Ventures,400000.0,Venture - Series Unknown,2020,Early Stage
Ewar,2016,Bangalore,Manufacturing,E-sports and real-time gaming startup,"Jindal Steels, Jeet Banerjee",200000.0,Venture - Series Unknown,2020,Early Stage
Setu,2016,Hyderabad,Technology,"Offers open APIs across four categories: bills, savings, credit, and payments.","Lightspeed Venture, Falcon Edge, Bharat Inclusive Technologies Seed Fund.",14259000.0,Series A,2020,Early Stage
Wellthy Therapeutics,2016,Bangalore,Health,It offers a digital therapeutics service,Saama Capital,4000000.0,Pre series A,2020,Early Stage
Power Gummies,2018,Delhi,Health,Offers health supplements related gummies,Venture Catalysts,3000000.0,Venture - Series Unknown,2020,Early Stage
Locale ai,2019,Bangalore,Business,It helps companies with moving assets  increase revenues and demand using real time location data and analytics,Better Capital,3000000.0,Venture - Series Unknown,2020,Early Stage
FarEye,2016,Delhi,Transport,"It enables businesses to execute, track, predict and oprimize the movements of goods","M12, Honeywell venture capital, Eight Roads Venture",24500000.0,Series D,2020,Early Stage
Rebel Foods,2016,Bangalore,Food & Beverages,It runs internet kitchen,Coatue Management,50000000.0,Venture - Series Unknown,2020,Early Stage
BankBazaar,2008,Chennai,Technology,Online marketplace that gives customers instant customised offers on loans and credit cards,"Amazon, Sequoia, Walden SKT Venture Fund",3800000.0,Series D,2020,Established
Porter,2014,Mumbai,Transport,Logistics and fleet management,Lightstone Global Funds,18370000.0,Series D,2020,Established
SugarBox,2016,Mumbai,Technology,Hyperlocal data distribution platform,Zee Entertainment Enterprises Limited,68525000.0,Venture - Series Unknown,2020,Early Stage
Capital Float,2013,Bangalore,Technology,Online platform that provides working capital finance to SMEs,"Amazon Inc`, Dinesh J Hinduja",4800000.0,Series F,2020,Established
Big Basket,2016,Bangalore,Commerce,Online grocery store,Alibaba Holdings,60000000.0,Venture - Series Unknown,2020,Early Stage
Amica,2016,Pune,Technology,Neobanking startup,"Hummingbird Ventures, Bedrock Capital",2000000.0,Venture - Series Unknown,2020,Early Stage
Vedantu,2016,Bangalore,Education,Onine learning platform,Legend Capital,12500000.0,Series C,2020,Early Stage
Fingerlix,2016,Bangalore,Food & Beverages,"It provides ready-to-cook products such as batters, mixes, curries, dals, parathas etc.,","Accel, Zephyr Peacock, Swiggy, RB Investments.",1834000.0,Venture - Series Unknown,2020,Early Stage
Plop,2016,Mumbai,Technology,It Provides an interactive fiction entertainment platform to entertain & educate Gen Z & Millennials in a language they understand,"Better Capital, LetsVenture, Rohit Chanana, Jayant Kadambi, Sunil Kumar Singhvi",3000000.0,Angel Round,2020,Early Stage
Zupee,2018,Mumbai,Manufacturing,It runs live quiz tournaments on its app.,Matrix Partners,8000000.0,Series A,2020,Early Stage
DeHaat,2012,Ahmadabad,Agriculture,Online marketplace for farming services and products,Sequoia Capital India,12000000.0,Series A,2020,Established
Lido Learning,2016,Mumbai,Education,Online teaching service,Bace Capital,7500000.0,Series B,2020,Early Stage
Aye Finance,2014,Gurugram,Technology,A finance lender to SMEs,Undisclosed,23850000.0,Venture - Series Unknown,2020,Established
Swiggy,2014,Bangalore,Food & Beverages,Platform to order food online from restaurants and getting it delievered,"Tencent, Ark Impact, Korea Investment Partners, Samsung Ventures, Mirae Asset Capital Markets",43000000.0,Series A,2020,Established
Akna Medical,2018,Pune,Health,Provides supply solutions for surgical and pharmaceutical products.,LGT Lightstone Aspada,7000000.0,Venture - Series Unknown,2020,Early Stage
Zomato,2016,Gurugram,Food & Beverages,Online food delivery and restaurant discovery platform,Pacific Horizon,5000000.0,Venture - Series Unknown,2020,Early Stage
RaRa Delivery,2016,Bangalore,Transport,Provides same day delivery service for ecommerce businesses,"Der Shing Lim, 500 startups",800000.0,Seed Round,2020,Early Stage
JusPay,2016,Bangalore,Technology,Online payment solutions,Vostok Emerging Finance,21600000.0,Series B,2020,Early Stage
Obviously AI,2018,Noida,Technology,It provides predictive insights to clients by leveraging their data,Arka Venture Labs,3000000.0,Venture - Series Unknown,2020,Early Stage
Fingpay,2016,Mumbai,Technology,Provides payment solutions,IvyCap Ventures,3500000.0,Series A,2020,Early Stage
Recko,2017,Bangalore,Technology,The platform enables AI-powered reconciliation of digital transactions,Vertex Ventures,6000000.0,Series A,2020,Early Stage
Furlenco,2012,Bangalore,Commerce,Furniture rental startup,"Chowdry Associates, Lightbox",10000000.0,Venture - Series Unknown,2020,Established
Mera Cashier,2019,Noida,Technology,App meant for small and micro businessmen to manage their transactions digitally,"Sukhbir Singh, India Accelerator, Boudhik Ventures, Shankar Nath, Shaurya Garg",150000.0,Venture - Series Unknown,2020,Early Stage
Kitchens Centre,2019,Hyderabad,Commerce,Offers solutions to cloud kitchens by providing commercial space and kitchen infrastructure to assisting with branding and other services,AngelList India,500000.0,Seed Round,2020,Early Stage
Camp K12,2016,Gurugram,Education,It connects students with tutors online,"Matrix Partners, SAIF Partners",4000000.0,Seed Round,2020,Early Stage
MedGenome,2013,Bangalore,Health,Genetic diagnostic testing company,LeapFrog Investments,55000000.0,Series D,2020,Established
Ergos,2016,Bangalore,Agriculture,It enables farmers to digitise their foodgrain and also provide access to supply chain solutions,Aavishkar Capital,4598000.0,Venture - Series Unknown,2020,Early Stage
Nykaa,2012,Mumbai,Commerce,Deals in cosmetic and wellness products,Steadview capital,13137000.0,Venture - Series Unknown,2020,Established
Samadhan,2018,Delhi,Finance,They help find solutions to insurance related issues,Venture Catalysts,3000000.0,Seed Round,2020,Early Stage
SaScan,2016,Bangalore,Health,Cancer diagnostics startup,Unicorn India ventures,3000000.0,Venture - Series Unknown,2020,Early Stage
Lido Learning,2016,Mumbai,Education,Online teaching service,"Pecus Capital, Madhur Deora",3000000.0,Venture - Series Unknown,2020,Early Stage
CureFit,2016,Bangalore,LifeStyle,"Integrated platform for food, fitness and meditation.",Temasek,115000000.0,Series D,2020,Early Stage
Nimesa,2018,Bangalore,Technology,Cloud data managemnt solutions enterprise,Ideaspring capital,3000000.0,Venture - Series Unknown,2020,Early Stage
Design X,2016,Noida,Technology,Builds IoT based products,ThinkNext LLC,200000.0,Seed Round,2020,Early Stage
Driftly Electric,2016,Bangalore,Technology,Electric vehicle startup,MG Motor India,3000000.0,Venture - Series Unknown,2020,Early Stage
Imstrong,2019,Bangalore,LifeStyle,It is an online and live video-streaming platform that allows trainers and fitness enthusiasts to connect and engage in interactive online classes.,Rainmatter,400000.0,Seed Round,2020,Early Stage
Craftsvilla,2016,Mumbai,Commerce,Online marketplace for ethnic wear,Supera Investments,3900000.0,Venture - Series Unknown,2020,Early Stage
Rupifi,2020,Bangalore,Technology,Offers financial products for SMEs,"Ashneer Grover, Kunal Shah, Ramakant Sharma",3000000.0,Pre seed round,2020,Early Stage
SnackAmor,2016,Mumbai,Food & Beverages,It offers various healthy snacks,Undisclosed,3000000.0,Seed Round,2020,Early Stage
Zealthy,2019,Bangalore,Health,"It connects women to healthproviders for specialities like infertility, maternity etc.,","KYT Ventures, First Cheque, AngelList",3000000.0,Seed Round,2020,Early Stage
CoinDCX,2016,Pune,Technology,A cryptocurrency trading platform,"Polychain Capital, Bain Capital Ventures, HDR Group",3000000.0,Series A,2020,Early Stage
NuNu TV,2016,New Delhi,Media & Entertainment,Kids-focussed Youtube channel,Risers Accelerators,670000.0,Venture - Series Unknown,2020,Early Stage
QTalk,2016,Bangalore,Technology,Smart Phone Dialer,"Accel India, Lightspeed Venture Partners",1600000.0,Seed Round,2020,Early Stage
Shadez,2018,Mumbai,LifeStyle,Paint Company,Inflection Point Ventures,100000.0,Seed Round,2020,Early Stage
Excess2Sell,2016,Mumbai,Commerce,B2B Marketplace for Overstock & Surplus Inventory,Gautham Madhavan,1000000.0,Venture - Series Unknown,2020,Early Stage
Stanplus,2016,Hyderabad,Health,Ambulance service,Pegasus FinInvest,1500000.0,Pre series A,2020,Early Stage
Pitstop,2016,Bangalore,Technology,Doorstep car service,TPG-backed Group Landmark,2500000.0,Series A,2020,Early Stage
Univariety,2015,Hyderabad,Education,Online marketplace that provides career counselling and college guidance,Info Edge,1100000.0,Venture - Series Unknown,2020,Established
Peel Works,2010,Mumbai,Technology,E-commerce for corner/retail stores.,CESC Ventures,3000000.0,"Series C, D",2020,Established
CoreStack,2016,Chennai,Technology,Enterprise cloud governance technology startup,Naya Ventures,8500000.0,Series A,2020,Early Stage
Vivriti Capital,2017,Chennai,Technology,Digital lending startup,LGT Lightstone Aspada,50000000.0,Series B,2020,Early Stage
Agnikul,2016,Chennai,Technology,"It designs, fabricates, tests and launch orbital class launch vehicles",pi Ventures,3148000.0,Pre series A,2020,Early Stage
Fintso,2020,Ahmedabad,Technology,Wealth management platform,"Rajeev Juneja, Pratul Shroff, Dilip Khandelwal, Piyush Gupta",2600000.0,Venture - Series Unknown,2020,Early Stage
Khatabook,2016,Bangalore,Technology,It helps SMEs to maintain their accounts and ledger online.,Mahendra Singh Dhoni,3000000.0,Venture - Series Unknown,2020,Early Stage
Smart Coin,2015,Gurgaon,Technology,Consumer lending startup,LGT LightstoneAspada,7000000.0,Series A,2020,Established
ZunRoof,2016,Gurugram,Technology,"It specialises in solar rooftop design, installation, and management using technology",Godrej Investments,3000000.0,Series A,2020,Early Stage
Shop101,2015,Delhi,Commerce,Enables entrepreneurs to sell online,"Stellaris Venture Partners, Unilever Ventures, Kalaari Capital, Vy Capital",3900000.0,Series C,2020,Established
OM Bhakti,2016,Bangalore,Commerce,A puja cotton-wicks manufacturing startup,Venture Catalysts,3000000.0,Seed Round,2020,Early Stage
Lal10,2016,Uttar Pradesh,Commerce,It helps Indian artisans and SMEs reach out to global retailers,Sorenson Impact,1100000.0,Venture - Series Unknown,2020,Early Stage
Anaxee Digital Runner,2016,Indore,Technology,A tech-enabled ID verification and data collection startup,Orios Venture Partners,3000000.0,Venture - Series Unknown,2020,Early Stage
CollegeKhabri,2019,Bhopal,Education,Platform is an end-to-end college and career counselling platform for students,Vishal Dixit,3000000.0,Venture - Series Unknown,2020,Early Stage
Ola Electric,2016,Bangalore,Transport,Electric vehicle,Pawan Munjal Family Trust Fund,1000000.0,Venture - Series Unknown,2020,Early Stage
Multi Living,2016,Mumbai,Real Estate,"It curates apartments from the homeowners, performs the quality check and offers the homes with built-in services to the potential tenants",Lodha Ventures,6000000.0,Venture - Series Unknown,2020,Early Stage
FamPay,2016,Bangalore,Technology,"It allows parents to send money to their kids below the age of 18, which they can spend securely under parent supervision.","Y Combinator, Venture Highway, Sequoia India, Global Founders Capital",4700000.0,Seed Round,2020,Early Stage
UnboxRobotics Labs,2016,Bangalore,Manufacturing,Automated flexible parcel sorting solutions for logistics providers,"Arali Ventures, CIIE.CO",500000.0,Seed Round,2020,Early Stage
Karbon Card,2016,Bangalore,Technology,Specialisde corporate cards for startups,"Kunal Shah, Amrish Rau, Jitendra Gupta",2000000.0,Seed Round,2020,Early Stage
Airmeet,2016,Bangalore,Business,"A platform to host, discover, and attend fully remote events like conferences and professional meet-ups",Accel India,3000000.0,Venture - Series Unknown,2020,Early Stage
Innerchef,2016,Gurgaon,Food & Beverages,Cloud kitchen platform,Mistletoe,1000000.0,Venture - Series Unknown,2020,Early Stage
Epigamia,2015,Mumbai,Commerce,Flavoured and greek yoghurt brand,KA Enterprise,3000000.0,Series C,2020,Established
